annotation,speaker,utterance,neutral,anger,disgust,fear,joy,sadness,surprise
1011011,Shelley,"I- just- I thought- Good, Shelley.",0,0,0,0,0,0,0
2020001,Joey,My agent would like to know why I didn't show up at the audition I didn't know I had today.,0,0,0,0,0,0,0
2010020,Chandler,"Well, I'll tell ya I do enjoy guilt, but, ah, it wasn't me.",0,0,0,0,0,0,0
5000000,Ross,Can I ask you something? Have you ever had a guy have a crush on you?,1,0,0,0,0,0,0
1310000,Ross,I do-I do,0,0,0,0,1,0,0
3010100,Ross,I dont know.,1,0,0,0,0,0,0
2000012,Ross,"I mean, last year Elizabeth now-now this kid.",0,0,0,0,0,0,0
1200011,Ross,Am I giving out some kind ofsexy professor vibe?,0,0,0,0,0,0,0
0040010,Rachel,"Oh, see now I feel bad for the kid!",0,0,0,0,0,1,0
2120000,Rachel,I had a crush on a teacher once and it was so hard!,0,0,0,0,0,0,0
4010000,Rachel,Yknow youI couldnt concentrate and I blushed every time he looked at me.,1,0,0,0,0,0,0
2110100,Rachel,"I mean come on, you remember whats its like to be 19 and in love.",0,0,0,0,0,0,0
1400000,Monica,"That's right baby! Okay, what do I want now?",0,0,0,0,1,0,0
5000000,Richard,"Yeah, I understand.",1,0,0,0,0,0,0
0300110,Carol,I got it!,0,0,0,0,1,0,0
2300000,Susan,"Oh, I wouldnt miss it for the world.",0,0,0,0,1,0,0
1400000,Susan,Hello Ross.  I love what youve done with this space.,0,0,0,0,1,0,0
0030101,Monica,"It took me 28 years to find one man that I wanna spend my life with, if I have to wait another 28 years then, I'll be 56 before I can have a baby, and that's just stupid.",0,0,0,0,0,1,0
3100010,Monica,"I don't need an actual man, just a couple of his best swimmers.",1,0,0,0,0,0,0
1000202,Ross,I dont have too. I can just look at you.,0,0,0,0,0,0,0
3110000,Monica,"Yeah, I do think its better this way.  Yeah, were being smart.   Yes, Im sure.",1,0,0,0,0,0,0
4000001,Monica,"Well uh, you and I are just goofing around, I thought, why not goof around with him.",1,0,0,0,0,0,0
3000002,Chandler,"Y'know, I don't know if you've ever looked up the term goofing around in the dictionary Well, I have, and the technical definition is, two friends who care a lot about each other and have amazing sex and just wanna spend more time together.",1,0,0,0,0,0,0
3010010,Monica,I think you're better than you think you are.,1,0,0,0,0,0,0
3010010,Chandler,"Y'know, I sensed that I should stop. So we're okay?",1,0,0,0,0,0,0
0000104,Janice,"Or, else you're pretending that you're seeing somebody, which just makes you so pathetic that I could start crying right here in the cereal aisle.",0,0,1,0,0,0,0
2111000,Chandler,Can I be that guy?,0,0,0,0,0,0,0
1000031,Dana,"Wow. Oh, I am really flattered, but I just I dont feel that way about you.",0,0,0,0,0,0,1
1010120,Rachel,"OK, well, you wouldn't let me finish and I was jus- [Monica flicks her back] Ow. That hurt [flicks Monica]",0,0,0,0,0,0,0
2000210,Phoebe,I know!  I know!  I know!,0,0,0,0,0,0,0
3000101,Phoebe,"Alright, now I will let go if you both stop.",1,0,0,0,0,0,0
2100200,Joey,Look at me! I'm Chandler! Could I,0,0,0,0,0,0,0
4000100,Joey,"I ah, I better not do any, I don't know, lunges.",1,0,0,0,0,0,0
3020000,Chandler,I dont need to have a game room.,1,0,0,0,0,0,0
5000000,Chandler,"I mean when I was a kid I only played those games because I couldnt get girls, and now I",1,0,0,0,0,0,0
4100000,Rachel,"Yeah, and I am okay with being a pushover.",1,0,0,0,0,0,0
0000410,Monica,I am not high maintenance!,0,1,0,0,0,0,0
0000410,Rachel,I am not a pushover!,0,1,0,0,0,0,0
1201010,Rachel,"Ok, I know this is gonna sound really stupid, but I feel that if I can do this, you know, if I can actually do my own laundry, there isn't anything I can't do.",0,0,0,0,0,0,0
4100000,Ross,"You know, it's like the first time I had to make dinner for myself, after Carol left me?",1,0,0,0,0,0,0
2030000,Janice,"Well, Sid and I are trying again and we had trouble last time    because apparently we...",0,0,0,0,0,1,0
4001000,Chandler,"No no no... I mean,",1,0,0,0,0,0,0
2300000,Chandler,"I'd love to stay, but I have eh...  got    a hot date...",0,0,0,0,1,0,0
4010000,Chandler,I think it just fell off.,1,0,0,0,0,0,0
1030100,Ross,"I don't want to be single, okay? I just... I just- I just wanna be married again!",0,0,0,0,0,1,0
0200111,Chandler,And I just want a million dollars!,0,0,0,0,0,0,0
3000200,Chandler,"I hear ya, Mugsy!",1,0,0,0,0,0,0
2001200,Chandler,"Can you just pick one so I can watch--have a perfect, magical weekend together with you.",0,0,0,0,0,0,0
0000212,Chandler,"Oh, I'm sorry, am I getting in the way of all the room switching fun?",0,0,0,0,0,0,0
0000410,Chandler,"Oh, who should I blame? The nice bell man who had to drag out luggage to 10 different rooms?",0,1,0,0,0,0,0
0000500,Monica,"I don't know, how about the idiot who thought he could drive from Albany to Canada on a half a tank of gas!",0,1,0,0,0,0,0
1000202,Chandler,"I just want to watch a little television. What is the big deal? Geez, relax mom.",0,0,0,0,0,0,0
0003101,Chandler,"I said, ""Geez, relax Monnnnn.""",0,0,0,1,0,0,0
5000000,Joey,Can I ask you something?,1,0,0,0,0,0,0
4001000,Joey,"I mean, the giant is like five years younger than me, yknow, you think Ill ever get there?",1,0,0,0,0,0,0
3020000,Joey,"I mean, theres no way I can make myself taller now, yknow?",1,0,0,0,0,0,0
0022010,Joey,"And who knows what science will come up with in the future, but Chandler, what if I die an unsuccessful, regular sized man?",0,0,0,0,0,0,0
0100301,Dr. Drake Remoray,"Thats right Wesley! I just stopped by to say that, youre not a real doctor! And that womans brain, is fine!",0,1,0,0,0,0,0
4100000,Rachel,"Umm, I am free tomorrow night.",1,0,0,0,0,0,0
4100000,Rachel,"Yeah, sure, sure I can bring some sandwiches.",1,0,0,0,0,0,0
1001012,Rachel,"That was 10 blocks from here and, the, the woman was walking alone at night, I would never do that.",0,0,0,0,0,0,0
2100110,Rachel,"Hi, hi can I help you?",0,0,0,0,0,0,0
5000000,Rachel,"Uh, no she doesn't but I can, I can get a message to her.",1,0,0,0,0,0,0
2210000,Ross,"So, Carol and I went behind a couple of those mechanical Dutch children... then they fixed the ride, and we were asked never to return to the Magic Kingdom.",0,0,0,0,0,0,0
5000000,Phoebe,Nah. I kept myself busy.,1,0,0,0,0,0,0
5000000,Phoebe,"Oh, okay, yeah.  I put your stuff in her room, and her stuff in your room.",1,0,0,0,0,0,0
3000002,Phoebe,"Ross, yknow if you ever decide you need to redecorateAnd I think that you should.",1,0,0,0,0,0,0
2100002,Phoebe,"Oh, come on! I think hes ready to get rid of, what did you call it? The cheap knock-offs and dinosaur junk.",0,0,0,0,0,0,0
4100000,Ross,"Since you have such a great sense of what I need, uh ooh, heres-heres 60 bucks, why dont you take Phoebe down to that Colonial flea market of yours and get me some stuff.",1,0,0,0,0,0,0
2021000,Rachel,"Yknow what? I dont, I dont think Phoebe really wants to come.",0,0,0,0,0,0,0
0300110,Phoebe,No! I do want to!,0,0,0,0,1,0,0
3000020,Phoebe,"Sure, yeah, no I can do that, yeah, because umm, y'know, the muscles in the siadic area can get yknow, real  nice and tight.",1,0,0,0,0,0,0
1001120,Phoebe,"I mean, all week long everywhere I look there's you.",0,0,0,0,0,0,0
4100000,Phoebe,"Okay, and then this is the coffee house. This is where I play my music.",1,0,0,0,0,0,0
1013000,Mark,"Um, y'know, before we go ah, theres something I need to say.",0,0,0,1,0,0,0
3000011,Gunther,I dropped a cup.,1,0,0,0,0,0,0
0500000,Phoebe,"Okay, and-and I promise that Ill keep you safe and warm until youre ready to have them take you home, so Oh!",0,0,0,0,1,0,0
2300000,Joey,"We went to a Mets game, we got Chinese food, and you know, I love this woman.",0,0,0,0,1,0,0
4100000,Janice,"I just came by to give you a kiss, I have to go pick up the baby, so.",1,0,0,0,0,0,0
1030001,Joey,"I'm sorry man, I tired, I really did.",0,0,0,0,0,1,0
4010000,Chandler,"Well, you know, I appreciate you giving it a shot.",1,0,0,0,0,0,0
2200010,Joey,"But, hey, look, you know the good thing is, is that we spent the whole day together and I survived, and what's even more amazing, so did she.",0,0,0,0,0,0,0
0000311,Monica,"Joey, youre this guys teacher. I mean how could you do this?",0,1,0,0,0,0,0
3011000,Joey,"Because, Monica, the guys so good, and I really, really want this part.",1,0,0,0,0,0,0
1000220,Joey,I don’t know! Maybe she’s crazy!,0,0,0,0,0,0,0
5000000,Janine,"Hey Joey, I got some beer for you.",1,0,0,0,0,0,0
5000000,Janine,"Sure, listen I was gonna order some pizza, you wanna share one?",1,0,0,0,0,0,0
4100000,Joey,"Pizza, heh, its not like I never had that before...ba dum bum cheshhh.",1,0,0,0,0,0,0
1022000,Joey,"Umm, look I like you.",0,0,0,0,0,0,0
1022000,Joey,"I-I really do, I like you a lot.",0,0,0,0,0,0,0
0010130,Katie,"Aww, like I could hurt you. Are you making fun of my size? Don't make fun of me because of my size!",0,0,0,0,0,0,1
0020021,Ross,"No, I get to teach one of his advanced classes!  Why didnt I get head of the department?",0,0,0,0,0,0,0
3101000,Joey,"I got a big date coming up, do you know a good restaurant?",1,0,0,0,0,0,0
2030000,Rachel,"Ooh, I miss dating.",0,0,0,0,0,1,0
3002000,Rachel,I mean not that sitting at home worrying about giving birth to a sixteen pound baby is not fun.,1,0,0,0,0,0,0
4100000,Joey,Why dont I take you out?,1,0,0,0,0,0,0
0500000,Joey,Yes I do!,0,0,0,0,1,0,0
5000000,Rachel,"Joey, I gotta tell ya, I've been thinking",1,0,0,0,0,0,0
2011010,Rachel,"Me? Oh, no, I am not an actress.",0,0,0,0,0,0,0
4010000,Joey,"Oh, all right, I can ask Monica.",1,0,0,0,0,0,0
0000041,Joey/Drake,I can't believe you married him.,0,0,0,0,0,0,1
1010210,Rachel/actress,But what choice did I have. He was keeping my sister    in a,0,0,0,0,0,0,0
0040100,Joey/Drake,How can I accept that...,0,0,0,0,0,1,0
0050000,Joey/Drake,I can never kiss you again when it's all I can do not    to kiss you right now.,0,0,0,0,0,1,0
1400000,Chandler,"I know this isn't the kind of Thanksgiving that all of you all planned, but for me, this has been really great, you know, I think because it didn't involve divorce or projectile vomiting.",0,0,0,0,1,0,0
1210010,Chandler,"Anyway, I was just thinking, I mean, if you'd gone to Vail, and if you guys'd been with your family, if you didn't have syphilis and stuff, we wouldn't be all together, you know?",0,0,0,0,0,0,0
1400000,Chandler,So I guess what I'm trying to say is that I'm very thankful that all of your Thanksgivings sucked.,0,0,0,0,1,0,0
0011300,Ross,"Look, look, your daughter and I are supposed to leave tonight for our honeymoon, now-now you-you tell her that Im gonna be at that airport and I hope that shell be there too!",0,1,0,0,0,0,0
0012011,Ross,"Oh yeah, I said Rachels name, but it didnt mean anything, Okay?",0,0,0,0,0,0,0
0221000,Ross,Now just tell Emily that I love her and that I cant imagine spending my life with anyone else.,0,0,0,0,0,0,0
0002030,Joey,"Well, I dont know!!",0,0,0,0,0,0,1
5000000,Ross,I think that would be best.,1,0,0,0,0,0,0
2030000,Chandler,"Umm ma’am, do you have a minute?  I kind of have some bad news. I don’t think I can move to Tulsa.",0,0,0,0,0,1,0
3002000,Chandler,"I kind of fell asleep  in the meeting this morning so when I said I’d move to Tulsa, I didn’t really  know what I was saying.",1,0,0,0,0,0,0
2003000,Chandler,"But only because I was up all night worried about this  meeting, ain’t that funny?",0,0,0,1,0,0,0
3001100,Chandler,I went home and told my wife about Tulsa and she won’t go.,1,0,0,0,0,0,0
0302000,Chandler,"See, me, I  love Tulsa!",0,0,0,0,1,0,0
3002000,Chandler,"Look, Carol, can I call you Carol?",1,0,0,0,0,0,0
2002010,Chandler,Wh-why  would I when your name is Elaine?,0,0,0,0,0,0,0
1202000,Chandler,I like a girl with a strong jaw.,0,0,0,0,0,0,0
3100010,Fake Monica,"I'm not too bad. Fortunately, blue's my colour. How-how did you know I was here?",1,0,0,0,0,0,0
1000040,Fake Monica,That I was not expecting.,0,0,0,0,0,0,1
5000000,Monica,"I want you to know, it wasn't me who turned you in.",1,0,0,0,0,0,0
0500000,Monica,"No, thank you! You have given me so much! I mean, if it wasn't for you, I would never have gotten to sing",0,0,0,0,1,0,0
1000040,Monica,I just can't believe you're in here.,0,0,0,0,0,0,1
1030010,Monica,"I mean, what am I gonna do without you?",0,0,0,0,0,1,0
0050000,Rachel,"Oh, I am so sorry.",0,0,0,0,0,1,0
0050000,Mindy,"No me, I am so sorry...",0,0,0,0,0,1,0
4001000,Monica,"Doctor, can I see you for just a minute please? My brother has a slight phobia about needles.",1,0,0,0,0,0,0
0500000,Ross,Youre gonna love me so much. I got Sting tickets!!,0,0,0,0,1,0,0
0300020,Phoebe,Oh my God! I do love you! How did you do it?!,0,0,0,0,1,0,0
0500000,Monica,Thats the kind of strength that I want in the man that I love!,0,0,0,0,1,0,0
0000500,Mr. Treeger,: No! Youre clogging up the chute that I spent a half-hour unclogging!,0,1,0,0,0,0,0
0031010,Rachel,Im sorry. I didntI dont come in here a lot.,0,0,0,0,0,1,0
1020110,Rachel,I didnt I never said that.,0,0,0,0,0,0,0
0100130,Ross,"It's no big deal, I mean it is her home phone number, but... Whoa!",0,0,0,0,0,0,1
0300020,Ross,"Whoa-whoops, I almost lost this baby!",0,0,0,0,1,0,0
0000050,Monica,I dont know how any of these got opened?!,0,0,0,0,0,0,1
0022001,Monica,"I know! I know! I am a terrible person! I mean, Chandler is never going to trust me with anything ever again!",0,0,0,0,0,0,0
1100021,Joey,"Well, I dont know. I think it does something to salami.",0,0,0,0,0,0,0
0500000,Joey,"I do Rach. I do, and I so happy for you.",0,0,0,0,1,0,0
2010002,Rachel,"No, I will. Im just not up for it tonight.",0,0,0,0,0,0,0
2021000,Joey,"Hey Rach listen, no matter what this guy says I want you to know youre not gonna be alone in this.",0,0,0,0,0,0,0
1013000,Joey,Listen I uh  Its a scary world out there especially if youre a single mom.,0,0,0,1,0,0,0
1210010,Joey,"Yknow, I always felt like you and I have this-this special bond.",0,0,0,0,0,0,0
0000401,Joey,If I cant have it you cant have it!,0,1,0,0,0,0,0
1000013,Monica,"I cant believe her, yknow its justits so typical.",0,0,1,0,0,0,0
5000000,Chandler,"Now Monica, I know youre upset, but dont forget.",1,0,0,0,0,0,0
1400000,Chandler,"Then we will sprinkle rose pedals on the bed and make love. Not just because its romantic, but because I can!",0,0,0,0,1,0,0
0500000,Monica,I love you!,0,0,0,0,1,0,0
0400010,Joey,I win again!,0,0,0,0,1,0,0
3200000,Joey,I gotta buy some food.,1,0,0,0,0,0,0
0103010,Chandler,I am brave!,0,0,0,1,0,0,0
0103010,Chandler,II am brave!,0,0,0,1,0,0,0
3200000,Gary,"So, can I get some candy?",1,0,0,0,0,0,0
3010001,Chandler,"I am sorry, but some of us have to",1,0,0,0,0,0,0
1030001,Monica,"Umm, listen I am sorry, but Ill put some out first thing in the morning.",0,0,0,0,0,1,0
2000030,Gary,Mm! Seems like I wouldve remembered you!,0,0,0,0,0,0,1
4010000,Joey,"So I uh, I just talked to the director. Thats it, were done for the day.",1,0,0,0,0,0,0
5000000,Joey,"So I got your car, its right outside.",1,0,0,0,0,0,0
5000000,Monica,"I know that theres no hole there, I just really liked that picture.",1,0,0,0,0,0,0
0000410,Rachel,I dont care! The wires have come loose in your head!,0,1,0,0,0,0,0
3011000,Monica,I just thought that if I could follow the wire I could find out what it did.,1,0,0,0,0,0,0
4010000,Monica,"No. It disappears back there behind that baseboard. For a minute there, I thought it went downstairs.",1,0,0,0,0,0,0
4000001,Rachel,"Ross, I really dont think",1,0,0,0,0,0,0
1031000,Monica,"I mean, I realize that his feelings may never completely go away, but",0,0,0,0,0,1,0
0140000,Janice,"Good-bye Monica , I wish you a lifetime of happiness with him.",0,0,0,0,0,1,0
1300010,Joey,I found my identical hand twin!,0,0,0,0,1,0,0
3001010,Phoebe,I wonder where she is. That is so weird.,1,0,0,0,0,0,0
4100000,Phoebe,Good.  I should really start wearing hats!,1,0,0,0,0,0,0
3000110,Monica,"I mean, why should I let them meet him?",1,0,0,0,0,0,0
1000103,Monica,"I mean, I bring a guy home, and within five minutes they're all over him.",0,0,1,0,0,0,0
1000202,Monica,"I mean, they're like- coyotes, picking off the weak members of the herd.",0,0,0,0,0,0,0
4100000,Paula,"I mean, they're your friends, they're just looking out after you.",1,0,0,0,0,0,0
1040000,Monica,"I know. I just wish that once, I'd bring a guy home that they actually liked.",0,0,0,0,0,1,0
5000000,Phoebe,"Anyway, I should go. Okay, bye.",1,0,0,0,0,0,0
4001000,Monica,I cant tell you. Its a secret.,1,0,0,0,0,0,0
2003000,Chandler,"Oh no-no, I cant do that.",0,0,0,1,0,0,0
5000000,Chandler,"So, Ross and I are going to",1,0,0,0,0,0,0
1000220,Chandler,Thats it?! I gave up my,0,0,0,0,0,0,0
3001010,Joey,"Im sorry, do I know you?",1,0,0,0,0,0,0
1000040,Joey,"Are you kidding me? I never rent a movie without it!  Oh.  Uh, okay uh let me call you back.",0,0,0,0,0,0,1
0102020,Joey,I know! My grandmothers gonna see this!,0,0,0,0,0,0,0
1000130,Ross,"What? Of course I did! You uh, you sat next to Sleepy Sleeperson.",0,0,0,0,0,0,1
4000010,Ross,"Oh uh, I had trouble remembering everyones name, so I-I kinda came up with nicknames.",1,0,0,0,0,0,0
0500000,Ross,"Listen, I gotta tell ya, I-Im having a great time!",0,0,0,0,1,0,0
2000030,Ross,"Yknow how before you said it might be weird, the whole student teacher thing, and to be frank I thought it would be too, but its not.",0,0,0,0,0,0,1
2000120,Ross,I mean its not at all.,0,0,0,0,0,0,0
2010020,Joey,I didn't get it?,0,0,0,0,0,0,0
3000020,Phoebe,What are you saying I should do?,1,0,0,0,0,0,0
4000001,Monica,"I think, that if you really like this guy, you should just trust him.",1,0,0,0,0,0,0
1000022,Monica,"Oh, that's what I would do, forget mine.",0,0,0,0,0,0,0
3100010,Phoebe,"Wow, I have the spirit of an old Indian women living in mine.",1,0,0,0,0,0,0
5000000,Phoebe,"The mailman was downstairs, so I brought up your mail.",1,0,0,0,0,0,0
3001001,Monica,"Um, but I saw this info-mercial, and um, I swear to you I have never-ever bought anything on TV before, except for this mop.",1,0,0,0,0,0,0
0500000,Phoebe,"Oh, its incredible! I so want to be a Waxine girl.",0,0,0,0,1,0,0
2000111,Rachel,"Oh, 'scuse me. I was kinda using that machine.",0,0,0,0,0,0,0
2000210,Rachel,But I saved it. I put my basket on top.,0,0,0,0,0,0,0
1000202,Woman,"Oh, I'm sorry, is that your basket? It's really pretty. Unfortunately, I don't see suds.",0,0,0,0,0,0,0
0400010,Receptionist,"Well, I think this is a great place to work!",0,0,0,0,1,0,0
2000120,Rachel,Ross do you realise this is the first time in my life Im doing something I actually care about.,0,0,0,0,0,0,0
2010110,Ross,"No, hey, I get that, okay, I get that big time.",0,0,0,0,0,0,0
0030200,Ross,"Okay, I dont know what to do anymore.",0,0,0,0,0,1,0
4000010,Ross,"Im sorry Im late, did I miss anything?",1,0,0,0,0,0,0
3101000,Ross,"Oh, on a date. Yeah, I met this girl on the train going to a museum upstate.",1,0,0,0,0,0,0
1301000,Ross,"Okay, it was just me and her at the back of the train, and I sat near the door, so shed have to pass by me if she wanted to switch cars.",0,0,0,0,1,0,0
0500000,Joey,"Done! I did it! Heh, whos stupid now?",0,0,0,0,1,0,0
1000301,Monica,I mean everyone will leave!,0,1,0,0,0,0,0
1000301,Monica,"I mean come on, that is just noise!",0,1,0,0,0,0,0
5000000,Chandler,"If you listen very carefully, I think its",1,0,0,0,0,0,0
1001030,Phoebe,"Oh, I want to look too! . Yikes!",0,0,0,0,0,0,1
3000011,Rachel,"I mean, like in the case of this young woman, she has lost her clothes, so she rides naked on the horse, shes crying out, Where are they, where are they?",1,0,0,0,0,0,0
3200000,Rachel,"You see, now, I would date this girl.",1,0,0,0,0,0,0
4100000,Rachel,"I mean, thats got to come in handy",1,0,0,0,0,0,0
5000000,Rachel,I dont know.,1,0,0,0,0,0,0
5000000,Phoebe,I dont know.  Me neither.,1,0,0,0,0,0,0
1040000,Monica,"Look, I wanted to tell Im-Im sorry you lost.",0,0,0,0,0,1,0
3100010,Chandler,"Listen, Ive got a secret for ya. I let him win.",1,0,0,0,0,0,0
2110010,Chandler,"No, I let him winRoss!",0,0,0,0,0,0,0
2111000,Chandler,Would you tell her I let you win please?,0,0,0,0,0,0,0
2010110,Chandler,I am strong! Ill show you!,0,0,0,0,0,0,0
2000030,Joey,Ohhh. I thought it was like Long Island.,0,0,0,0,0,0,1
3100010,Joey,Yeah. I realized it about a half-hour ago but I didn't want to say anything 'cause I didn't want to jinx it.,1,0,0,0,0,0,0
1101020,Joey,"Oh, I-I, I think that's the first time I ever missed a meal!  Yeah, my pants are a little loose!",0,0,0,0,0,0,0
3000110,Ursula,"Yeah, can I help you with something?",1,0,0,0,0,0,0
3200000,Ursula,"Yeah, I can talk them into giving you like, 30 dollars.",1,0,0,0,0,0,0
3110000,Phoebe,"One, my friends are the most important thing in my life, two, I never lie, and three, I make the best oatmeal raisin cookies in the world.",1,0,0,0,0,0,0
0000050,Rachel,"Ok, thanks Pheebs  Oh my God, why have I never tasted these before?!",0,0,0,0,0,0,1
2210000,Phoebe,"Oh, I don't make them a lot because I don't think it's fair to the other cookies",0,0,0,0,0,0,0
3100100,Phoebe,Which proves that I never lie.,1,0,0,0,0,0,0
4010000,Rachel,I guess you don't.,1,0,0,0,0,0,0
4000010,Chandler,Why would I be freaking out?,1,0,0,0,0,0,0
4001000,Monica,"I mean, whats the harm in that?",1,0,0,0,0,0,0
2012000,Monica,"Chandler, please dont think I was trying to pressure you. Phoebe and Rachel",0,0,0,0,0,0,0
4100000,Monica,I know! I know.,1,0,0,0,0,0,0
2011100,Monica,Im gonna go tell Joey that  that youre back. I was really worried about you.,0,0,0,0,0,0,0
0400010,Phoebe,I cant believe youre gonna ask Monica to marry you!,0,0,0,0,1,0,0
4000100,Rachel,"Okay look, I have an idea.",1,0,0,0,0,0,0
1000211,Rachel,I dont think so.,0,0,0,0,0,0,0
0050000,Phoebe,"Ohh, I lost my mom to suicide.",0,0,0,0,0,1,0
1030100,Phoebe,Did I use that already today? Im sorry.,0,0,0,0,0,1,0
1400000,Rachel,"Oh, I win! Hes got",0,0,0,0,1,0,0
0001040,Monica,I cant believe this. Do you think that your parents could help pay for it?,0,0,0,0,0,0,1
1020002,Chandler,"I dont know, my mother spent most of her money on her fourth wedding.",0,0,0,0,0,0,0
3200000,Rachel,I mean you dont have to have this rustic Italian feast.,1,0,0,0,0,0,0
4100000,Joey,I will sit with you Dr. Geller.,1,0,0,0,0,0,0
0030101,Ross,"Now, I look around this cafeteria, and yknow what I see, I see-I see division.",0,0,0,0,0,1,0
0020021,Ross,"Division, between people in white coats and people in blue blazers, and I ask myself, ""My God why?!""",0,0,0,0,0,0,0
3200000,Ross,"Now, I say we shed these-these coats that separate us, and we get to know the people underneath.",1,0,0,0,0,0,0
1310000,Ross,"Im divorced, and I have a kid!",0,0,0,0,1,0,0
1400000,Joey,Im Joey! Im an actor! I dont know squat about dinosaurs!,0,0,0,0,1,0,0
2111000,Another Tour Guide,"Im Ted, and I just moved here a month ago, and New York really scares me.",0,0,0,0,0,0,0
3110000,Older Scientist,"Im Andrew, and I didnt pay for this pear.",1,0,0,0,0,0,0
0014000,Another Scientist,And I need to flip the light switch on and off 17 times before I leave a room or my family will die.,0,0,0,1,0,0,0
2300000,Doug,"Its good to have you guys on my team, and I come to play.",0,0,0,0,1,0,0
5000000,Doug,I hope you do too.,1,0,0,0,0,0,0
1002020,Chandler,"Oh its Bing, sir. Im sorry , I was just ah...",0,0,0,0,0,0,0
3200000,Doug,"No-no, I heard what you said, funny.",1,0,0,0,0,0,0
2300000,Doug,I like funny.,0,0,0,0,1,0,0
5000000,Ross,"Rach, I got a message from you.",1,0,0,0,0,0,0
1010030,Ross,"OK, I need to lie down.",0,0,0,0,0,0,1
0400010,Joey,"I know! I know! It turns out that one of the casting ladies has actually seen me in a play, so I steered clear of her",0,0,0,0,1,0,0
1000103,Ross,"I mean look at him, look at you,",0,0,1,0,0,0,0
3200000,Joey,"That's great. Listen, wouldn't it be great though if I got to play Ben's dad?",1,0,0,0,0,0,0
0200210,Joey,I look more like him than you do!,0,0,0,0,0,0,0
1000211,Carol,"Y'know, I don't really know you well enough for you to do that.",0,0,0,0,0,0,0
1110110,Chandler,"Hm-hmm, I told you!  I cant believe that Ive only got two hours before I call in sick for work.",0,0,0,0,0,0,0
3010100,Monica,I have to be up in seven minutes.,1,0,0,0,0,0,0
4000010,Kristen,"Oh I, I have plans tonight.",1,0,0,0,0,0,0
4100000,Kristen,"You look strong, why dont I take that and you grab one of the boxes.",1,0,0,0,0,0,0
5000000,Phoebe,": Yeah, um...  You know you, you should just forget about what I said under the bridge, I was talkin'",1,0,0,0,0,0,0
1201010,Phoebe,"That's right, I don't... But I was, I was drunk on you!",0,0,0,0,0,0,0
0041000,Ross,"Look, I-Im really sorry I let go of the bike.",0,0,0,0,0,1,0
0000500,Phoebe,I couldve been killed I hope you know!,0,1,0,0,0,0,0
0032000,Ross,"I know. I know. But, can we please try it again? Huh? I mean, you were",0,0,0,0,0,1,0
2020100,Phoebe,"Well, I would love to butthe bike got stolen and the police have no suspects.",0,0,0,0,0,0,0
5000000,Ross,"I was going to tell you, but",1,0,0,0,0,0,0
0000410,Ross,Hey! I did not dump Rachel!  Nor are we still together.  Can I just  Why dont we just let the machine get that?,0,1,0,0,0,0,0
0011120,Ross,"No! No! No! No! No! I-I-I-II need to, I need to lie down.",0,0,0,0,0,0,0
2001020,Joey,"Whoa!! Now look, dont be just blurtin stuff out. I want you to really think about your answers. Okay?",0,0,0,0,0,0,0
2000102,Joey,"Oh dont listen to him, hes just some guy who really wants the apartment, but I dont think hes gonna get it.",0,0,0,0,0,0,0
